{
  "schema_version": "repo-assessment-explanation.v1",
  "explanation_id": "assess-expl-example-non-default-branch",
  "assessment_ref": "assess-example-non-default-branch-evidence-missing",
  "summary": "Assessment assess-example-non-default-branch-evidence-missing is interpreted with status set [non_default_branch]. This explanation is read-only interpretation and does not authorise or plan actions.",
  "status_explanations": [
    {
      "status": "non_default_branch",
      "meaning": "Current branch differs from observed default branch candidate; remote branch lifecycle remains not observed in this read-only assessment.",
      "decision_effect": "requires_evidence",
      "evidence_refs": [
        "obs-example-feature-branch-clean",
        "git.rev_parse.worktree",
        "git.current_branch",
        "git.rev_parse.head",
        "git.rev_parse.toplevel",
        "git.status.porcelain",
        "git.upstream",
        "git.ahead_behind",
        "git.remote.origin.url",
        "git.default_branch_candidate",
        "local_config.canonical_repo_roots",
        "local_config.excluded_repo_roots",
        "filesystem.path"
      ],
      "rule_refs": [
        "assessment.rule.non_default_branch_requires_lifecycle_evidence"
      ],
      "freshness_refs": [
        "freshness.local_git_branch.current_invocation",
        "freshness.remote_branch_lifecycle.not_observed_no_fetch"
      ],
      "falsification_refs": [
        "failure-case.feature_branch_unmerged",
        "failure-case.origin_main_stale"
      ],
      "missing_evidence": [
        "branch_contains_origin_main_or_pr_merged",
        "fresh_origin_main"
      ]
    }
  ],
  "boundary": {
    "does_not_authorise_actions": true,
    "does_not_mutate": true,
    "does_not_plan_actions": true
  }
}
